1 Product Name,2 Product Image,3 Short Description,4 Product Description,5 Brand Name,6 Brand Description
Power Wreck,https://ddd33q3967xhi.cloudfront.net/RmR8fOqwlz16baF3b1xPCkFnCUM=/fit-in/300x300/https%3a%2f%2fddd33q3967xhi.cloudfront.net%2fGcQfcAQMCcmYRFeYgo4tozLT1hk%3d%2ffit-in%2f400x400%2fhttps%253a%252f%252fs3.amazonaws.com%252fleafly-s3%252fproducts%252fphotos%252f3fIkjQpTLa5QgXGBjRrw_power%2bwreck.jpg,"Nutty //// Citrus, earthy, spicy",Packs and extreme punch with an extreme head high and nice body buzz. Gives you the munchies while allowing you to feel like Superman and accomplish anything and everything!,Cannabis Nation Cultivation,"What began as medical grow operation in Portland, Oregon, has emerged as a leader in Oregon's cannabis industry with a collection of dispensaries serving the Pacific Northwest.  Topping Leafly's ""Best of the Month"" list multiple times, we strive to continue to provide the highest-quality product and professionalism.

At Cannabis Nation dispensaries, our storefronts have been exquisitely designed with a unique open layout, allowing customers to take their time and enjoy browsing our plentiful selection of only the highest quality cannabis flower, much of which is still cultivated in-house, as well as top-shelf concentrates, edibles, topicals and tinctures.

Or, if you would prefer, our expert Budtenders will assist you personally.  Whether you are a first-time consumer, business professional, senior citizen, or OMMP cardholder, we will strive to ensure that any questions you have are answered and that you leave with the product that fits your needs and lifestyle.

With four dispensaries located in Beaverton, Seaside, Gresham, Oregon City and a fifth location coming soon to Sun River, our family of young entrepreneurs hopes that one day our company's name reflects reality.

Visit us soon and join the Cannabis Nation!"
