1 Product Name,2 Product Image,3 Short Description,4 Product Description,5 Brand Name,6 Brand Description
Blue Dream,https://ddd33q3967xhi.cloudfront.net/g7GSH5VfkejhWBiXTRs3GfIGHa0=/fit-in/300x300/https%3a%2f%2fddd33q3967xhi.cloudfront.net%2f7IS1JTAKifqe1e40genL0B3o-Nk%3d%2ffit-in%2f400x400%2fhttps%253a%252f%252fs3.amazonaws.com%252fleafly-s3%252fproducts%252fphotos%252fSyVAWyuTTsutvZBEAtif_blue%2bdream.jpg,Not Your Average Blue Dream!,"Pearl Pharma's Blue Dream is a Sativa-dominant Hybrid with blueberry flavors and creative, energetic experiences. Ideal for helping you feel social and energetic.",Pearl Pharma,"Pearl Pharma is a cultivation company that has been growing since 1998. Our most famous strain would be our Kosher Jack, followed closely by our Sin Mint Cookies from seeds by SinCity Seeds. 

Located in multiple dispensaries and delivery services across Southern California, Pearl Pharma has flower, concentrates, and pre-rolls for any mood of your week."
Blue Galaxy,https://ddd33q3967xhi.cloudfront.net/MID2FmC1KFaddtTFJls10Lup0S0=/fit-in/300x300/https%3a%2f%2fddd33q3967xhi.cloudfront.net%2fLL3B29tYG0Ns7yJk1J-zNN1T0_Y%3d%2ffit-in%2f400x400%2fhttps%253a%252f%252fs3.amazonaws.com%252fleafly-s3%252fproducts%252fphotos%252fhdsy4bdSKWUPleQ6MHvr_blue%2bgalaxy.jpg,This potent indica strain will influence great relaxation and euphoria.,"Afghani x Hashplant (I) - Coming from two of the earliest varieties of cannabis, this Middle Eastern cross has heavy resin production, which both of its predecessors are notorious for having. With a very complex nose, Blue Galaxy has the best of both worlds combining an earthy hash smell with a fruity-sweetness. This potent strain will influence great relaxation and euphoria. A real couch lock kind of high.",Royal Tree Gardens,"It all started in the Summer of 2013 with an idea and a dream. 

With the passing of Initiative 502 in the fall of 2013 came the realization that opportunity was at hand. Having had experience growing for the medical side of the industry and a true passion for the plant, Max, Ryan and Spencer came together and founded what is now Royal Tree Gardens.

In March 2014, without the certainty of being licensed by the state, we apprehensively signed a lease on a warehouse in Tacoma, WA, where together, over the next 7 months, we designed and built-out the warehouse from the ground up. Through countless hours of hard work and dedication, we were able to complete the majority of the build-out ourselves while concurrently developing a brand-centric business plan with a focus and commitment to quality. Starting with a blank canvas allowed us to combine our knowledge of the cannabis growing environment and design a truly top tier facility for our plants.

In December 2014, after countless obstacles and setbacks, and applicable permits in hand, we finally received our license from the Washington State Liquor Control Board and were given the go ahead to begin producing cannabis.

More recently, after months of unconditional labor, we have welcomed on Judd as a part of the ownership. Charlie, a Master Grower and brother of Co-Founder Max, has also been added as a part of the ownership team and brings invaluable experience and work ethic.

Presently, the team here at Royal Tree Gardens is working extremely hard to produce the highest quality cannabis for the recreational market here in Washington. We feel privileged to be working with so many close friends and are excited share with you our passion for the plant!"
Blue Hawaiian,https://ddd33q3967xhi.cloudfront.net/mag9hskC3oQZ5p0vmD2spq3kSXU=/fit-in/300x300/https%3a%2f%2fddd33q3967xhi.cloudfront.net%2fEGrfIcTQumg1BfzBIVcgDiXDeGk%3d%2ffit-in%2f400x400%2fhttps%253a%252f%252fs3.amazonaws.com%252fleafly-s3%252fproducts%252fphotos%252fJKs4ES0XRM2XXrraHyAq_blue-hawaiian-flower-1600x1600.jpg,The in house Apollo Grown Blue Hawaiian is one of our speciality strains. Expect a full body mouthful of sweet citrus and tropical berry aromas.,"The in house Apollo Grown Blue Hawaiian is one of our speciality strains. Expect a full body mouthful of sweet citrus and tropical berry aromas. The Blue Hawaiian also packs a punch with our latest batch coming in at just over 20% THC. With a beautiful terpene profile, great look and feeling, the Blue Hawaiian is hard to beat.",Apollo Grown,"In Greek mythology, Apollo was the son of Zeus and traditionally one of the most complex and important Gods. He was the God of music, truth, prophecy, healing, light, poetry, and creativity. Most importantly, it’s said that Apollo would ride Pegasus, the winged-horse, to the top of Mount Olympus every morning in order to bring the sun to the people.
The goal of Apollo Grown Inc. is to incorporate this energy into our practice of cultivating the highest quality recreational marijuana products that Oregon has to offer. Like the God Apollo, we strive to be leaders in our community and dedicate ourselves to help make the world a better place through our actions. This motto filters into each and every facet of our company."
Bruce Banner,https://ddd33q3967xhi.cloudfront.net/VG7z4d-QVJVCtdW-jlrQcleHjTE=/fit-in/300x300/https%3a%2f%2fddd33q3967xhi.cloudfront.net%2fg1MLSpZ3bE4CuIGmkxoYIcA201A%3d%2ffit-in%2f400x400%2fhttps%253a%252f%252fs3.amazonaws.com%252fleafly-s3%252fproducts%252fphotos%252fmiQMcXdFQxy7WMpHdkze_bruce.jpg,"When Hulk wants to smash, stay calm with Bruce Banner! This OG Kush x Strawberry Diesel hybrid will morph you back into sanity after a stressful day.","When Hulk wants to smash, stay calm with Bruce Banner! This OG Kush x Strawberry Diesel hybrid will morph you back into sanity after a stressful day. Just stay away from large doses of gamma rays...",Dream City,"Greetings from all of us at Dream City!

We are a Tier 3 Producer/Processor located in historic Port Townsend on the Olympic Peninsula. Our company has an established reputation for delivering premium cannabis to our consumers and the highest level of service in the industry. Our commitment to honesty, integrity and customer satisfaction has allowed us to add “consistent quality” to our reputation as well. We use only honest test results and are competitively priced.

Our product is grown in soil. We believe the flavor benefits outweigh the production benefits of soilless grown product. We use 100% climate controlled, state-of-the-art greenhouses that allow us to maximize our ability to produce premium cannabis. Our use of pesticides is focused on Integrated Pest Management (IPM), and minimal amounts of WSLCB-allowed pesticides.

Our signature purple packaging and unique labels allow for our product to visually stand out amongst other brands while our beautiful Galatea dances on the back of the package, a testament to our Port Townsend heritage. We are always emerging with new products and product strains. Our inventory/price list is regularly updated and available to our retailers through a live link. We encourage any of our retail partners to bring their team up to the site for tours of the facility with the goal of educating and inspiring fellow members of the cannabis community."
Buddies Death Bubba,https://ddd33q3967xhi.cloudfront.net/3EYDeCXRhd0pN2QxXspCvt4FsMU=/fit-in/300x300/https%3a%2f%2fddd33q3967xhi.cloudfront.net%2flz6rhZV8YBapgI21ioDjizpBzX8%3d%2ffit-in%2f400x400%2fhttps%253a%252f%252fs3.amazonaws.com%252fleafly-s3%252fproducts%252fphotos%252fEIMDg6oiQ8esawAgcL3n_death.jpg,INDICA,"Premium
Indica
Death Bubba by BuddiesCanada.ca",Buddies Canada,"Your one stop shop for some of the best products available today at some of the best prices around!

For all purchases please visit our website at BuddiesCanada.ca

Follow us on social media to participate in product giveaways and free contests!
Facebook: Buddies Canada
Instagram: @buddies_canada"
CandyLand,https://ddd33q3967xhi.cloudfront.net/IKwXNqnKISni4y4f3F4iN02vH9I=/fit-in/300x300/https%3a%2f%2fddd33q3967xhi.cloudfront.net%2fiN3OraABTMhayCCYI1nkp3uxxwg%3d%2ffit-in%2f400x400%2fhttps%253a%252f%252fs3.amazonaws.com%252fleafly-s3%252fproducts%252fphotos%252fnbF9hikuTUqkaTGMWNl2_Candyland%2bGH2.JPG,Granddady Purple x Platinum GSC (f.k.a. Girl Scout Cookies),"The smooth, tight, dense buds are a pale shade of soft green highlighted with a trace of darker green and coated with tiny, pure crystals that fill up every hidden nook and cranny. Upon closer examination, there is a subtle sexy array of long, dark golden hairs that beautifully highlight each nugget. CandyLand’s medical properties include: pain management, muscle relaxation, mood enhancement, and is a fantastic social stimulus. This is the strain that will make washing the dishes fun.",Fox Hollow Flora,"The purpose of Fox Hollow Flora is to help humanity recover our inherited connection with cannabis by providing the world with flowers of utmost quality and products that represent our highest integrity.  Our motivation is forged by the hard truth that you will always get out exactly what you put in.  Our country is depending on us to set a standard for Pacific Northwest cannabis that will be unmatched by any other region in the world.  We accept this honor to represent the great state of Oregon in this special moment of our nation’s history. We will never take it for granted.

Core values at Fox Hollow Flora:

1.	Respect: Consideration for Humanity and the Earth.
2.	Integrity: Sincere in our decisions and Actions.
3.	Family and Community: We all have a Stack in this Together.
4.	Innovation: We will never limit ourselves to the Present."
Cannalope Kush,https://ddd33q3967xhi.cloudfront.net/RskayDuHpFOnuuPzIKUglbjBOLk=/fit-in/300x300/https%3a%2f%2fddd33q3967xhi.cloudfront.net%2fA32DWCJ3fk_SGqwq1rBmOju9Q8Q%3d%2ffit-in%2f400x400%2fhttps%253a%252f%252fs3.amazonaws.com%252fleafly-s3%252fproducts%252fphotos%252fdzX3KxnRaSoEPToxTPfz_cantalaupe.jpg,Sativa dominant - but with a banaced indica effect to feel uplifted and happy.,"OG#18 mixed with Cannalope creates this master peice of a strain. leaves you enjoying the energy and clear-headedness of a sativa, and the full body euphoria of an indica.",Vodis USA,"Our acclaimed master growers know that the finest quality marijuana is nurtured through respect. That’s why our natural products are tenderly crafted, hand harvested - and a tribute to those who enabled this illustrious journey.

We take pride in what we do, so that in turn, you can indulge in a smooth, full-flavored experience."
Cannatonic,https://ddd33q3967xhi.cloudfront.net/JoIOxTJtba7wOpJOJCjGxqLMRkI=/fit-in/300x300/https%3a%2f%2fddd33q3967xhi.cloudfront.net%2fAGAkKJlc3SP5U55TQNsy3wZyKws%3d%2ffit-in%2f400x400%2fhttps%253a%252f%252fs3.amazonaws.com%252fleafly-s3%252fproducts%252fphotos%252fHeKuq7JTAetNjY7aHmhi_Tilray-SquareTC200Bag.jpg,A hybrid cross with that is known to produce a nearly 1:1 ratio of THC & CBD.,"A hybrid cross with that is known to produce a nearly 1:1 ratio of THC & CBD. 
Top terpenes include Caryophyllene, Humulene, and Myrcene.",Tilray,"Tilray is a global leader in medical cannabis research and production dedicated to providing safe, consistent and reliable therapy to patients. We are the only GMP certified medical cannabis producer currently supplying products to thousands of patients, physicians, pharmacies, hospitals, governments and researchers in Australia, Canada, the European Union and the Americas."
CBD Critical Mass,https://ddd33q3967xhi.cloudfront.net/xj3ADIb2JVupGkb2_xrzqD8Cx0w=/fit-in/300x300/https%3a%2f%2fddd33q3967xhi.cloudfront.net%2fjKqTBIj_tX6j9iMdNxj5iaZonZ0%3d%2ffit-in%2f400x400%2fhttps%253a%252f%252fs3.amazonaws.com%252fleafly-s3%252fproducts%252fphotos%252fqu4LYzXORiKEyWd1R2bA_Critical%2bmass.jpg,Strong aromas of dried mango leading into sweet earth and pine on the finish. Perfectly balanced blend of CBD and THC relieve the body and focus the mind.,Strong aromas of dried mango leading into sweet earth and pine on the finish. Perfectly balanced blend of CBD and THC relieve the body and focus the mind.,Dream City,"Greetings from all of us at Dream City!

We are a Tier 3 Producer/Processor located in historic Port Townsend on the Olympic Peninsula. Our company has an established reputation for delivering premium cannabis to our consumers and the highest level of service in the industry. Our commitment to honesty, integrity and customer satisfaction has allowed us to add “consistent quality” to our reputation as well. We use only honest test results and are competitively priced.

Our product is grown in soil. We believe the flavor benefits outweigh the production benefits of soilless grown product. We use 100% climate controlled, state-of-the-art greenhouses that allow us to maximize our ability to produce premium cannabis. Our use of pesticides is focused on Integrated Pest Management (IPM), and minimal amounts of WSLCB-allowed pesticides.

Our signature purple packaging and unique labels allow for our product to visually stand out amongst other brands while our beautiful Galatea dances on the back of the package, a testament to our Port Townsend heritage. We are always emerging with new products and product strains. Our inventory/price list is regularly updated and available to our retailers through a live link. We encourage any of our retail partners to bring their team up to the site for tours of the facility with the goal of educating and inspiring fellow members of the cannabis community."
Chemdawg,https://ddd33q3967xhi.cloudfront.net/zCbP6KTsJp30QqPC1-CwW1zPAdo=/fit-in/300x300/https%3a%2f%2fddd33q3967xhi.cloudfront.net%2fD6VxSmsdbMOs03N-uGQgV-rpiZk%3d%2ffit-in%2f400x400%2fhttps%253a%252f%252fs3.amazonaws.com%252fleafly-s3%252fproducts%252fphotos%252feuOKugZcQ3yw5oQLZAOx_403.jpg,Bulk Indoor Chemdawg Flower @ 20%+ THC,"5 lbs of Indoor Chemdawg Flower @ Wholesale Prices

Our ""Heavenly Flowers"" are always properly trimmed, dried and cured to perfection. All of our flower and products are Lab tested for THC, CBD, pesticides, mold and mildew, and packaged to leave our farm in a way that will preserve freshness and extend the shelf life for our retailers.

$1,500 per lb (1 - 4 lbs)
$1,300 per lb (5 - 9 lbs)",Leilani Farms,"Leilani Farms is a licensed medical cannabis producer and wholesaler.

We supply local medical marijuana dispensaries with high-quality top shelf product at wholesale prices.

You can be sure that our ""Heavenly Flowers"" are the best in class, beyond the test results!
​
Our Mission: At Leilani Farms, we seek to supply our patients and accounts with the highest quality medical marijuana products at competitive wholesale pricing. The cornerstone of our organization has always been our passion for Cannabis due to the proven medical benefits that it offers. We understand that you have many options when it comes to suppliers, but our commitment to customer service and quality separates us from the rest."
Cherry Pez Livity,https://ddd33q3967xhi.cloudfront.net/zobat92YNMwlREPXtKfJGQ7FN5A=/fit-in/300x300/https%3a%2f%2fddd33q3967xhi.cloudfront.net%2fIOiT1nzBg9CIigD9IywMzDwlaPU%3d%2ffit-in%2f400x400%2fhttps%253a%252f%252fcdn.filepicker.io%252fapi%252ffile%252fYMynTx8ITsSW9AYDSnTk,Cherry Pez Livity is known particularly for tasting just like the candy and the childlike fun this strain will induce.,"Cherry Pez Livity is known particularly for tasting just like the candy and the childlike fun this strain will induce. Terpene Profile : Citrus, Spice, Robust, Herbaceous, Earth",Cannasol Farms,"Nature intended for plants to be grown in the sun, and at Cannasol Farms, it is our dedication to growing the finest cannabis for over 20 years that led us to recognize that sun grown plants produce a better product. With dozens of unique strains, we have spent years perfecting the art and science of sustainable cannabis.

Because we believe cannabis only reaches its full potential in a natural environment, we grow our plants under the powerful Okanogan sunshine. Our complex sativa dominant strains take longer to mature, and their colas (the flower of the plant) need natural full spectrum sunlight to develop mature trichomes, which leads to more potent and rich cannabinoid profiles. You can see, smell, and taste the difference.

Because quality takes time, we don’t rush the plant. Many growers get eager to package their product, leaving it too green and raw. In order to achieve a more complex and refined terpene profile, you need time to slow cure as you would a fine tobacco or coffee. Cannasol Farms proudly slow cures our flowers for taste and experience rarely achieved in cannabis today. We select the best colas of the harvest to be hanged dry and slow cured in cool, low oxygen conditions. This allows the chlorophyl to degrade which smooths the smoke and allows the terpenes to be fully expressed, enhancing the cannabinoid profile. Cannasol Farms proudly long cures our flowers for taste and experience rarely achieved in cannabis today.

Cannasol cannabis is pure and natural, free from harsh pesticides and artificial chemicals. Only baking soda, potassium bicarbonate, and vinegar is used to prevent mildew and mold and regulate PH."
Cherry Pie,https://ddd33q3967xhi.cloudfront.net/Q2J4nYeGAqMbqPPn89VC7OQDWG0=/fit-in/300x300/https%3a%2f%2fddd33q3967xhi.cloudfront.net%2feH3UYfgdjI_NCBGEy7uDnfaWGs8%3d%2ffit-in%2f400x400%2fhttps%253a%252f%252fcdn.filepicker.io%252fapi%252ffile%252fXdboDoefSOmleWUmFXJ3,"This bud tastes and smells as you would expect, like sweet berries and delicious cherry pie.","Cherry Pie is a cross between Granddaddy Purple and Durban Poison. This bud tastes and smells as you would expect, like sweet berries and delicious cherry pie. Cherry Pie's effects come on very quickly and have been known to last for hours. Cherry Pie can be very relaxing and euphoric, providing you with lots of smiles and laughs. Cherry Pie is known for dense buds with a touch of purple and lots of orange hairs.",Cannasol Farms,"Nature intended for plants to be grown in the sun, and at Cannasol Farms, it is our dedication to growing the finest cannabis for over 20 years that led us to recognize that sun grown plants produce a better product. With dozens of unique strains, we have spent years perfecting the art and science of sustainable cannabis.

Because we believe cannabis only reaches its full potential in a natural environment, we grow our plants under the powerful Okanogan sunshine. Our complex sativa dominant strains take longer to mature, and their colas (the flower of the plant) need natural full spectrum sunlight to develop mature trichomes, which leads to more potent and rich cannabinoid profiles. You can see, smell, and taste the difference.

Because quality takes time, we don’t rush the plant. Many growers get eager to package their product, leaving it too green and raw. In order to achieve a more complex and refined terpene profile, you need time to slow cure as you would a fine tobacco or coffee. Cannasol Farms proudly slow cures our flowers for taste and experience rarely achieved in cannabis today. We select the best colas of the harvest to be hanged dry and slow cured in cool, low oxygen conditions. This allows the chlorophyl to degrade which smooths the smoke and allows the terpenes to be fully expressed, enhancing the cannabinoid profile. Cannasol Farms proudly long cures our flowers for taste and experience rarely achieved in cannabis today.

Cannasol cannabis is pure and natural, free from harsh pesticides and artificial chemicals. Only baking soda, potassium bicarbonate, and vinegar is used to prevent mildew and mold and regulate PH."
Cherry Wu,https://ddd33q3967xhi.cloudfront.net/yTOA7GjaEvMCy0bhRTuLY9qmVZY=/fit-in/300x300/https%3a%2f%2fddd33q3967xhi.cloudfront.net%2fclM8VQ3ljHElJeQenmat24yRv7o%3d%2ffit-in%2f400x400%2fhttps%253a%252f%252fs3.amazonaws.com%252fleafly-s3%252fproducts%252fphotos%252fx8hhMoqDThmEiRDzy8YF_cherry%2bwu_dry%2bflower_bedford%2bgrow-4.jpg,High CBD strain. 5:4 CBD:THC,"Cherry Wu is a CBD strain with versatility, great for day or evening use. With this flower patients may experience a smooth, clear-headed effect with anticonvulsant and anti-inflammatory properties.",Bedford Grow,"From seed to patient, Bedford Grow upholds itself to the highest standards in plant care and quality products to provide therapeutic healing for the patients of Illinois."
City of God,https://ddd33q3967xhi.cloudfront.net/K0D09-WPY0r0TRxpvinRI-tV3Tw=/fit-in/300x300/https%3a%2f%2fddd33q3967xhi.cloudfront.net%2fQIQNd5z9VGbTzCh2O_ix1l6O5WI%3d%2ffit-in%2f400x400%2fhttps%253a%252f%252fs3.amazonaws.com%252fleafly-s3%252fproducts%252fphotos%252fpaLV4EObSs6LXWyVBhzx_City%2bof%2bGod.jpg,Description coming soon.,"Type | Hybrid
Genetics | NY City Diesel x God Bud",Phantom Farms,"Phantom Farms, a licensed recreational cannabis producer, was founded in Oregon in 2008 on the principle that the best products come straight from the earth. We cultivate Clean Green Certified® cannabis using organic methods, sustainable practices and volcanic filtered water in both our indoor and outdoor facilities. No exceptions. When aligned, these factors provide for a flourishing ecosystem – the perfect environment for mighty tasty cannabis."
Cookies and Cream ,https://ddd33q3967xhi.cloudfront.net/hjfa3uFg6mBsewk5B5xg9dTCfIU=/fit-in/300x300/https%3a%2f%2fddd33q3967xhi.cloudfront.net%2f7kGfVeUIShW6Ic80gxoaSRK8_Uo%3d%2ffit-in%2f400x400%2fhttps%253a%252f%252fs3.amazonaws.com%252fleafly-s3%252fproducts%252fphotos%252fDScL7hLRqj635EwldZSw_coockies%2bn%2bcreme.jpg,Sweet cookies strain,Smooth � cookie flavor with cream tones,Cooks Canna,San Francisco Bay Area producer of medical cannabis flowers
Cookie Stomper,https://ddd33q3967xhi.cloudfront.net/tjNo11dSCGWjAOqWWft7Aw_RuZQ=/fit-in/300x300/https%3a%2f%2fddd33q3967xhi.cloudfront.net%2f6OTwPo0fGZ7c0-2i8MS8Rfjp-y0%3d%2ffit-in%2f400x400%2fhttps%253a%252f%252fs3.amazonaws.com%252fleafly-s3%252fproducts%252fphotos%252fqrVCqrWcTo6M3ScAmhJb_Screen%2bShot%2b2017-11-07%2bat%2b10.01.00%2bPM.png,"earthy, berry, sweet","In House
Hybrid, Indica Dominant
Genetics: GSC (f.k.a. Girl Scout Cookies) X 9lb Hammer
Flavor: earthy, berry, sweet
High: happy, relaxed, euphoric, sleepy",Clandestine Gardens,"Clandestine Gardens formed with the intent to produce and process the finest cannabis in Washington State. The team optimizes extreme care in handling the product from start to finish. They practice with an old school vibe, and with knowledge of harvesting the finest of crops."
Cream Royale,https://ddd33q3967xhi.cloudfront.net/imHW2xtAQNREf5951ELG7_vimb0=/fit-in/300x300/https%3a%2f%2fddd33q3967xhi.cloudfront.net%2fo9-cUwJN9uCL59QRlpUPQvg_yME%3d%2ffit-in%2f400x400%2fhttps%253a%252f%252fs3.amazonaws.com%252fleafly-s3%252fproducts%252fphotos%252f3Du50zHTv24RgY4fCCrD_cream%2broyale.jpg,The sweet floral notes bounce off of the thick and fruity smoke to create a high that instantly promotes harmony with the universe.,"Type | Hybrid
Genetics | Peaches & Cream x Royal Kush

The sweet floral notes bounce off of the thick and fruity smoke to create a high that instantly promotes harmony with the universe. The stress immediately slips away, leaving you with a peaceful glow and gentle curiosity.",Phantom Farms,"Phantom Farms, a licensed recreational cannabis producer, was founded in Oregon in 2008 on the principle that the best products come straight from the earth. We cultivate Clean Green Certified® cannabis using organic methods, sustainable practices and volcanic filtered water in both our indoor and outdoor facilities. No exceptions. When aligned, these factors provide for a flourishing ecosystem – the perfect environment for mighty tasty cannabis."
Critical Cure,https://ddd33q3967xhi.cloudfront.net/-4_SCVVwbwp-OqPplBmNIRP5-C0=/fit-in/300x300/https%3a%2f%2fddd33q3967xhi.cloudfront.net%2fNWUjItjpvexbkcv-cVPMjx3njAk%3d%2ffit-in%2f400x400%2fhttps%253a%252f%252fs3.amazonaws.com%252fleafly-s3%252fproducts%252fphotos%252faLPdAoRMCmnlfVKNPfPw_crit.jpg,Sun grown high CBD organic flower,A few tokes of this fresh flower is sure to cure what ails you!  Grown the natural way.,Winberry Farms,"Specializing in Organic Flower and Extracts

One of the first recreational cannabis farms to be licensed by the state of Oregon, Winberry Farms was started by friends and their families. Specializing in naturally sungrown product from quality genetics, our flower is expertly cultivated, perfectly cured, and farm fresh to you. Always grown with organic process and fertilizers. Our farm is located in the Southern Willamette Valley 30 miles southeast of Eugene, nourished naturally by the waters of Winberry Creek."
Dawg Cookies,https://ddd33q3967xhi.cloudfront.net/kykCW1RcnhHq2E-zo1LXetdbpwk=/fit-in/300x300/https%3a%2f%2fddd33q3967xhi.cloudfront.net%2fttZWAT891RCCmqjogsQLGZxIWCY%3d%2ffit-in%2f400x400%2fhttps%253a%252f%252fs3.amazonaws.com%252fleafly-s3%252fproducts%252fphotos%252fPLYE4QsLQXKzZqqZQrg9_dc%2bOG.jpg,Chemdawg x GSC (f.k.a. Girl Scout Cookies),,Dicot Farms,"Using all-organic cultivation methods, Dicot Farms is committed to providing the finest organically grown cannabis."
